{
  "artifact_id": "BE-CQC-P4-S2-R1",
  "schema_version": "0.1",
  "source_srp_id": "SRP-CQC-P3-02-R1",
  "source_srp_sha256": "67036a5c48d02608a25ba00c85260162dc6bce74a78ba4079f0c12f18e6cf1a0",
  "budget_intent": {
    "mode": "STANDARD",
    "operator_goal": "normal research pass"
  },
  "total_envelope": {
    "wall_clock": {
      "target_minutes": 25,
      "hard_ceiling_minutes": 40
    },
    "model_tokens": {
      "target_tokens": 300000,
      "hard_ceiling_tokens": 500000
    }
  },
  "allocations": [
    {
      "allocation_id": "AL01",
      "requirement_id": "R01",
      "route_id": "historical_lineage",
      "activation": "COMMITTED",
      "wall_clock_target_minutes": 10,
      "model_token_target": 120000,
      "rationale": "R01 receives the largest allocation because its stopping condition requires candidate paradigm categories to reach evidential saturation under the admitted paradigm criterion."
    },
    {
      "allocation_id": "AL02",
      "requirement_id": "R02",
      "route_id": "terminology_boundary",
      "activation": "COMMITTED",
      "wall_clock_target_minutes": 6,
      "model_token_target": 60000,
      "rationale": "判定基准显式确立是 CQ-01 候选筛选的前提义务。"
    },
    {
      "allocation_id": "AL03",
      "requirement_id": "R03",
      "route_id": "historical_lineage",
      "activation": "COMMITTED",
      "wall_clock_target_minutes": 6,
      "model_token_target": 60000,
      "rationale": "谱系映射依赖 R01 清单，规模可控。"
    }
  ],
  "escalation_policy": {
    "triggers": [
      {
        "trigger": "a REQUIRED route remains unresolved at target budget",
        "action": "REALLOCATE_WITHIN_CEILING"
      },
      {
        "trigger": "a CONDITIONAL route becomes epistemically activated",
        "action": "REALLOCATE_WITHIN_CEILING"
      },
      {
        "trigger": "the hard ceiling would be exceeded",
        "action": "REQUEST_ENVELOPE_EXPANSION"
      }
    ]
  },
  "feasibility": {
    "status": "FEASIBLE",
    "unfunded_obligations": [],
    "constraint_note": "STANDARD envelope: all 3 REQUIRED routes funded; no conditional routes exist in this SRP."
  }
}
