{
  "artifact_id": "BE-CQC-P4-S1-R2",
  "schema_version": "0.1",
  "source_srp_id": "SRP-CQC-P3-01",
  "source_srp_sha256": "67755617b29aef2f3d80f53b20fb9fb2434fe8512a4dae5472fe9263e83380ea",
  "budget_intent": {
    "mode": "STANDARD",
    "operator_goal": "normal research pass"
  },
  "total_envelope": {
    "wall_clock": {
      "target_minutes": 25,
      "hard_ceiling_minutes": 40
    },
    "model_tokens": {
      "target_tokens": 300000,
      "hard_ceiling_tokens": 500000
    }
  },
  "allocations": [
    {
      "allocation_id": "AL01",
      "requirement_id": "R01",
      "route_id": "mechanism_evidence",
      "activation": "COMMITTED",
      "wall_clock_target_minutes": 10,
      "model_token_target": 120000,
      "rationale": "R01/mechanism_evidence 是 S1 最大的单一证据义务，因此获得最大的 committed 资源分配。"
    },
    {
      "allocation_id": "AL02",
      "requirement_id": "R03",
      "route_id": "measurement_observability",
      "activation": "COMMITTED",
      "wall_clock_target_minutes": 8,
      "model_token_target": 90000,
      "rationale": "观测技术边界决定 CQ-01 证据的可靠性与缺口，属必答题。"
    },
    {
      "allocation_id": "AL03",
      "requirement_id": "R02",
      "route_id": "mechanism_evidence",
      "activation": "RESERVE_CONDITIONAL",
      "wall_clock_target_minutes": 5,
      "model_token_target": 50000,
      "rationale": "人群比较仅在 R01 证据暗示人群间差异时激活。"
    },
    {
      "allocation_id": "AL04",
      "requirement_id": "R02",
      "route_id": "counterexample_negative_evidence",
      "activation": "RESERVE_CONDITIONAL",
      "wall_clock_target_minutes": 3,
      "model_token_target": 30000,
      "rationale": "反例检索仅在跨人群外推主张出现时激活。"
    }
  ],
  "escalation_policy": {
    "triggers": [
      {
        "trigger": "a REQUIRED route remains unresolved at target budget",
        "action": "REALLOCATE_WITHIN_CEILING"
      },
      {
        "trigger": "a CONDITIONAL route becomes epistemically activated",
        "action": "REALLOCATE_WITHIN_CEILING"
      },
      {
        "trigger": "the hard ceiling would be exceeded",
        "action": "REQUEST_ENVELOPE_EXPANSION"
      }
    ]
  },
  "feasibility": {
    "status": "FEASIBLE",
    "unfunded_obligations": [],
    "constraint_note": "STANDARD envelope: 2 REQUIRED routes funded (mechanism core + observability); 2 conditional reserves held for population comparison and counterexample retrieval."
  }
}
